-69.7583,43.7083,"Seguin Island Lighthouse-Popham Beach,ME","Grounds open, tower/dwelling open from Memorial Day through Labor Day. This lighthouse is best seen by visiting the island by boat"
-70.2241,43.6519,"Spring Point Ledge Light-Portland Harbor,ME","Grounds open, tower open occasionally. open to the public on select days during the summer. Call (207) 699-2676 for dates "
-69.8016,43.8166,"Squirrel Point Light-Arrowsic Island,ME","Grounds open, Tower/dwelling closed. Requires a 0.5 mile hike"
-69.1848,43.9611,"Tenants Harbor Lighthouse-Southern Island,ME",Best seen by boat. Grounds/Tower/dwelling closed
-69.0738,43.9643,"Two Bush Lighthouse-Two Bush Island,ME",Best seen by boat. Grounds/Tower closed
-66.9505,44.815,"West Quoddy Head Lighthouse-West Quoddy State Park,ME","Grounds open, dwelling open in season, tower closed. open daily from mid-May to mid-October from 10:10 a.m. to 4:00 p.m. Call (207) 733-2180 "
-70.6967,43.0583,"Whaleback Ledge Light-Mouth of Piscataqua River,ME","Best seen by boat, but distant view can be had from Fort Foster Park. Tower closed"
-69.125,43.9784,"Whitehead Lighthouse-Whitehead Island,ME",Best seen by boat. Grounds/Tower/dwelling closed
-67.2275,45.1625,"Whitlocks Mill Light-Calais,ME",Privately owned. Grounds/Tower/dwelling closed
-68.0878,44.3616,"Winter Harbor Lighthouse-Mark Island,ME",Can be seen offshore from Arcadia National Park. Privately owned. Grounds/Tower/dwelling closed
-70.3292,43.4567,"Wood Island Lighthouse-Biddeford Pool,ME",Grounds/dwelling/tower open in season. Tours to the lighthouse are now also provided by Friends of Wood Island Lighthouse. 207 286-3229
-83.4232,45.0601,"Alpena Harbor Light-Alpena,MI",Tower closed
-86.1391,46.67314,"Au Sable Point Light-Au Sable Point-Pictured Rocks National Lakeshore,MI","Grounds open, dwelling/tower open in season. Tours of the lighthouse are offered in the summer.Contact Pictured Rocks National Lakeshore. 1.5 mile hike reqd"
-85.5763,45.5773,"Beaver Head Lighthouse-Beaver Island,MI",Grounds/tower open. Dwelling closed. Ferry to Beaver Island reqd
-85.5088,45.7425,"Beaver Island Harbor (St. James)Light-Beaver Island,MI",Tower closed. Ferry to Beaver Island reqd
-87.9669,47.3742,"Bete Grise (Mendota) Light-Bete Grise,MI",Privately owned. Grounds/dwelling/tower closed
-87.68,46.8417,"Big Bay Point Lighthouse-Big Bay,MI","Grounds open, dwelling/tower opened to guests and guided tours.For information on dates and times of guided tours, call the lighthouse at (906) 345-9957"
-86.514486,44.057625,"Big Sable Point Lighthouse-Ludington,MI","Grounds open, dwelling/tower open in season.  Open daily from 10 a.m. to 5 p.m., May through October. Call (231) 845-7343 to confirm hours. 1.8 mile hike each way reqd to reach lighthouse"
-84.4208,45.8111,"Bois Blanc Island Lighthouse-Bois Blanc Island,MI",Best viewed from the water. Privately owned. Grounds/Tower/dwelling closed.
-87.3538,45.4086,"Cedar River Lighthouse-Cedar River,MI",Privately owned. Grounds/dwelling closed
-83.44109,44.03745,"Charity Island Lighthouse-Charity Island,MI","Privately owned. Grounds open , dwelling closed. Ferry reqd to reach island"
-85.264551,45.319911,"Charlevoix South Pier Light-Charlevoix,MI","Grounds open, Tower closed"
-84.464087,45.657729,"Cheboygan Crib Light-Cheboygan,MI","Grounds open, Tower closed. Walk the breakwater to the light"
-84.4728,45.6473,"Cheboygan River Front Range Light-Cheboygan,MI","Grounds open, dwelling/tower open in season.Open 9:00 a.m. to 5:00 p.m. on Saturdays, Sundays and Holidays from Memorial Day weekend through Labor Day weekend. "
-84.465545,45.656197,"Cheboygan River Lighthouse-Cheboygan,MI","Grounds open, Tower closed. "
-84.4151,45.6684,"Cheboygan Ruins Lighthouse-Cheboygan State Park,MI",Grounds open. Located in Cheboygan State Park. Ruins only and requires a mile hike
-86.6913,46.4367,"Christmas (End of the Road) Range Light-Christmas,MI","Grounds open, Towers (2) closed"
-87.8602,47.4744,"Copper Harbor(Gull Rock) Lighthouse-Copper Harbor,MI","Grounds open, dwelling open during tours, tower closed.The road which leads to the Copper Harbor Lighthouse is not open to the public. Boat service is available from May to October. For more information, call (906) 289-4966. "
-87.8667,47.4678,"Copper Harbor Range Lights-Copper Harbor,MI","Grounds open, dwelling/tower closed.The rear range light is now home to the assistant manager of Fort Wilkins State Park, so respect their privacy. From the range lights, you can walk to the harbor and view the Copper Harbor Lighthouse across the water. "
-85.2572,46.7528,"Crisp Point Light-Crisp Point,MI","Grounds open, tower open in season.open on Saturdays mid-June to September from noon to 5:00 p.m. Call (906) 492-3206 for more information"
-83.9033,45.9483,"DeTour Reef Lighthouse-Lake Huron at St Mary's River,MI","Best seen by boat,but you can get a decent view from the end of Lighthouse road.Visitors to the lighthouse must be physically capable of climbing and descending a 20-foot ladder to reach the lighthouse deck. During ascent and descent of the ladder, each person will wear a safety harness "
-83.141218,42.000885,"Detroit River Light-Lake Erie and Detroit River,MI",Best seen by boat. Tower closed
-88.1596,47.4597,"Eagle Harbor Lighthouse-Eagle Harbor,MI","Grounds open, dwelling/tower open in season. open from mid-June to early October. Call (906) 337-1263 for more information"
-88.1543,47.4555,"Eagle Harbor Range Light-Eagle Harbor,MI",Privately owned. Grounds/dwelling closed
-88.2994,47.4138,"Eagle River Lighthouse-Eagle River,MI",Privately owned. Grounds/Tower/dwelling closed
-82.42241,43.006318,"Fort Gratiot Light-Port Huron,MI","Grounds/tower open during tours.Tours of the lighthouse can be arranged through the Port Huron Museum. 11:00 am through 5:00 pm, Friday, Saturday, Sunday, and Monday. (810) 455-0214 extension 119"
-83.913682,45.486097,"Forty Mile Point Lighthouse-Rogers City,MI","Grounds open, dwelling/tower open in season.Lighthouse and outbuildings are open on Saturdays and Sundays from noon to 4 p.m. from Memorial Day weekend to mid-October. The lighthouse is home to a museum. The tower is open for climbing during visiting hours. "
-84.4347,45.6798,"Fourteen Foot Shoal Lighthouse-Cheboygan,MI",Best viewed by boat. Fair views are available of the lighthouse near the ruins on the Cheboyan Main Light in Cheboygan State Park and from the Cheboygan Crib Light.
-89.1202,46.9919,"Fourteen Mile Point Lighthouse-12.5 miles northeast-Ontonagon,MI","Privately owned. Grounds open .It is possible to walk along the shoreline of Lake Superior to reach Fourteen Mile Point Lighthouse, but the hike is twelve miles round-trip"
-86.252254,44.630839,"Frankfort North Breakwater Lighthouse-Frankfort,MI","Grounds open, Tower closed. You can walk the breakwater to the lighthouse."
-86.252355,44.629442,"Frankfort South Breakwater Light-Frankfort,MI",Light is at the end of the breakwater.
-84.3411,46.5001,"Frying Pan Island Light-DeTour Village,MI","Grounds open, Tower closed"
-86.255907,43.056949,"Grand Haven Lighthouse-Grand Haven,MI","Grounds open, tower closed.you can walk the breakwater to the Grand Haven Lighthouses"
-86.253819,43.057237,"Grand Haven Inner Lighthouse-Grand Haven,MI","Grounds open, tower closed.you can walk the breakwater to the Grand Haven Lighthouses"
-86.255957,43.058203,"Grand Haven North Breakwater Light-Grand Haven,MI",You can walk the breakwater to the light.
-86.6207,46.4577,"Grand Island East Channel Light-Grand Island,MI",Must be seen by boat. Privately owned. Grounds/Tower/dwelling closed
-86.68,46.4604,"Grand Island North Lighthouse-Grand Island,MI",Must be seen by boat. Privately owned. Grounds/Tower/dwelling closed
-85.9715,46.6767,"Grand Marais Light-Grand Marais,MI","Grounds open, dwelling open in season, towers closed. The museum in the keeper's dwelling is open daily from 1 p.m. to 4 p.m. during July and August and is open for the same hours on weekends during June and September. "
-85.549912,45.210224,"Grand Traverse Lighthouse-Leelanau State Park,MI","Grounds open, dwelling/tower open in season.open daily during the month of May and from Labor Day through October from noon to 4 p.m. From June through Labor Day, the lighthouse is open from 10 a.m. to 6 p.m. Noon to 4:00 p.m. are the hours on weekends in November. call (231) 386-7195 "
-87.4114,46.7208,"Granite Island Lighthouse-Granite Island,MI",Must be seen by boat. Privately owned. Grounds/Tower/dwelling closed
-83.537,44.0184,"Gravelly Shoal Light-Saginaw Bay,MI",Tower closed. The best place to view this light from the shore is at the tip of a peninsula six miles east of Au Grey
-85.1542,45.7656,"Grays Reef Ligh-4 miles west-Waugoshance Island,MI",Best viewed by boat. Tower closed
-83.1419,42.1683,"Grosse Ile Light-Grosse Ile Island,MI",Grounds/tower closed except during annual tour.The Grosse Ile Historical Society opens the lighthouse the Sunday after Labor Day
-87.6639,47.4169,"Gull Rock Lighthouse-Gull Rock,MI",Must be seen by boat. Grounds/Tower/dwelling closed
-82.630601,43.845869,"Harbor Beach Light-Harbor Beach,MI","Grounds/tower closed.A good, distant shot of the Harbor Beach Lighthouse can be had from the end of the fishing pier in the park. "
-82.6518,42.5504,"Harsens Island Rear Range Light-Harsens Island,MI","Privately ownedGrounds/dwelling/tower closed., best seen from the water, but can also be seen from Harsens Island"
-86.212407,42.772673,"Holland Harbor Lighthouse-Holland,MI","Grounds open, tower closed. Area is mainly private property, and although limited public access is permitted, a lengthy walk is required to reach the lighthouse. "
-86.215799,42.773467,"Holland Harbor North Breakwater Light-Holland,MI",Light is at the end of the breakwater.
-86.215794,42.772552,"Holland Harbor South Breakwater Light-Holland,MI",Light is at the end of the breakwater.
-87.9983,46.9633,"Huron Island Lighthouse-Huron Islands National Wildlife Refuge,MI","Grounds open, dwelling/tower closed.West Huron Island (Lighthouse Island) is open to the public during daylight hours and must be reached by private boat"
-88.76198,47.94846,"Isle Royale (Menagerie Island)Light-Menagerie Island,MI","Must be seen by boat. Grounds open, Tower closed"
-88.4129,46.97844,"Jacobsville (Portage River) Lighthouse-Jacobsville,MI","Grounds/tower opens for tours, dwelling for overnight guests. Tower tours are offered on Sundays from noon to 2 p.m., July through September, or any time of year by reservation. Call (906) 523-4137 to make arrangements. "
-88.6305,47.2343,"Keweenaw Waterway Upper Entrance Light-Keweenaw Waterway,MI",Tower closed. View the light from the shore
-82.755,42.465,"Lake St. Clair Light-middle of Lake-Lake St Clair,MI",Best viewed from the water. Tower closed
-85.5616,45.9034,"Lansing Shoal Lighthouse-12 miles north-Beaver Island,MI",Must be seen by boat. Tower closed
-82.42661,42.989514,"Lightship Huron-Port Huron,MI","Grounds open, lightship open in season. Open daily from Memorial Day to Labor Day from 11 a.m. to 5 p.m. September through December and April through May, the lightship is open Thursday through Monday during the same hours. For further information, call (810) 982-0891. "
-86.539567,43.651387,"Little Sable Point Light-Silver Lake State Park,MI","Grounds open, dwelling/tower open in season. open Wednesday through Sunday from 10 a.m. to 5 p.m., June through September. Call (231) 845-7343 to confirm hours. "
-84.9782,45.4188,"Little Traverse Lighthouse-Harbor Springs,MI",Grounds/dwelling/tower closed.Lighthouse is part of a gated community. The best way to see this light is from the water
-86.469381,43.953673,"Ludington North Pierhead Lighthouse-Ludington,MI","Grounds open, tower open during the summer.open from 10 a.m. to 5 p.m., Wednesday through Sunday, in June, July, and August. Call (231) 845-7343 to confirm hours of operation. "
-86.469182,43.951961,"Ludington South Pierhead Light-Ludington,MI",Located at the end of the pierhead.
-84.729183,45.787422,"Mackinac Point Lighthouse-Mackinaw City,MI","Grounds open, dwelling/tower open in season.open daily from mid-May to early October. Call (231) 436-4100 for more information. "
-86.346965,44.251791,"Manistee North Pierhead Light-Manistee,MI","Grounds open, Tower closed. Walk the breakwater to the light"
-86.349953,44.251439,"Manistee South Pierhead Light-Manistee,MI",Located at the end of the breakwater.
-86.2466,45.945,"Manistique East Breakwater Light-Manistique,MI","Grounds open, Tower/dwelling closed. Walk the breakwater to the light"
-87.5878,47.4194,"Manitou Island Light-Manitou Island,MI","Best seen by boat. Grounds open, Tower/dwelling closed"
-87.3743,46.5348,"Marquette Breakwater Light-Marquette,MI","Grounds open, Tower closed. Walk the breakwater to the light"
-87.3762,46.5467,"Marquette Harbor Lighthouse-Marquette,MI","Grounds/dwelling open during tours, tower closed. open daily from mid-May to mid-October from 10:00 a.m. to 5:00 p.m. For tour times, call (906) 226-2006"
-84.1484,45.9132,"Martin Reef  Light-7 miles offshore-Port Dolomite,MI",Must be seen by boat. Tower closed
-84.773093,45.787094,"McGulpin's Point Lighthouse-2 miles west of Mackinac Point Lighthouse-Mackinac,MI",Privately owned. Grounds/Tower/dwelling closed
-87.5856,45.0969,"Menominee North Pier Light-Menominee,MI","Grounds open, Tower closed. Walk the breakwater to the light"
-83.32151,45.1933,"Middle Island Lighthouse-2.5 miles offshore-10 miles north-Alpena,MI","Grounds and outbuildings open to overnight visitors and tours, tower closed.You can visit the lighthouse on volunteer trips to the island offered on summer weekends or even spend a night in the fog signal building. Call Captain Mike Theut at (989) 619-1013 for more information. "
-84.17665,46.32497,"Middle Neebish (Lower Nicolet) Range Light-Neebish Island in St Mary's River,MI","Grounds open, Tower closed. 1 mile hike reqd."
-86.998509,45.58146,"Minneapolis Shoal Light-offshore entrance-Little Bay De Noc,MI",Must be seen by boat. Tower closed
-86.6616,46.415,"Munising Range Lights-Munising,MI",Grounds open. Tower/dwelling closed
-86.341461,43.226679,"Muskegon South Pier Light-Muskegon,MI","Grounds open, Tower closed"
-86.342026,43.227606,"Muskegon North Pier Light-Muskegon,MI",Light is at the end of the north pier.
-86.347092,43.224085,"Muskegon South Breakwater Light-Muskegon,MI",Light is at the end of the breakwater.
-86.348242,43.22555,"Muskegon North Breakwater Light-Muskegon,MI",Light is at the end of the breakwater.
-86.748111,41.800987,"New Buffalo Lighthouse (replica)-New Buffalo,MI","Grounds open, Tower closed"
-85.9563,45.0199,"North Manitou Shoal Light-offshore-Manitou Island,MI",Must be seen by boat. Tower closed
-85.479504,44.991233,"Old Mission Point Lighthouse-Penisula Township Park,MI",Grounds open. Tower/dwelling open.
-89.3281,46.876,"Ontonagon Lighthouse-Ontonagon,MI","Grounds/dwelling/tower open during tours. Tours are offered during the summer at 11 a.m., 2 p.m., and 4:00 p.m., Monday - Friday, and at 11 a.m. and 3:00 p.m. on Saturday. Tours are also available by appointment during the off-season and can be arranged by calling the museum at (906) 884-6165"
-89.3295,46.8789,"Ontonagon West Pierhead Light-Ontonagon,MI",Can be viewed from the Ontonagon Lighthouse or from the beach on the eastern side of the Ontonagon River. 
-88.3666,48.2234,"Passage Island Light-Isle Royale National Park,MI","Must be seen by boat. Grounds open, Tower closed"
-82.49177,42.716348,"Peche Island Light-Marine City,MI","Grounds open, Tower closed"
-86.9666,45.6683,"Peninsula Point Light-between Little Bay De Noc and Big Bay De Noc,MI","Grounds open, tower open.The last mile of the journey, which is a narrow, winding, dirt road"
-86.44362,43.782346,"Pentwater North Pier Light-Pentwater,MI",View the lights from Charles Mears State Park
-86.444134,43.781969,"Pentwater South Pier Light-Pentwater,MI",View the lights from Charles Mears State Park
-84.9616,45.38,"Petoskey Pierhead Light-Petoskey,MI",Tower closed. Can be viewed from the marina
-83.9,46.0167,"Pipe Island Lighthouse-Pipe Island,MI","Privately owned. Grounds/Tower/dwelling closed, Best seen by boat, but can be seen from the shoreline on Sims St"
-84.362,45.6949,"Poe Reef  Lighthouse-offshore-Bois Blanc Island,MI",Best viewed by boat. Tower closed.Fair views are available from Lighthouse Point near the ruins of the Cheboyan Main Light Station in Cheboygan State Park. 
-86.255253,44.691241,"Point Betsie Lighthouse-Point Betsie,MI","Grounds open, dwelling/tower open in season.open on weekends from Memorial Day to Columbus Day. During July and August, the lighthouse is also open on Fridays. 231-352-4915 "
-84.632135,46.4843,"Point Iraquois Lighthouse-Point Iraquios,MI","Grounds open, dwelling/tower open in season.The lighthouse is typically open daily Memorial Day through October 15 from 9 a.m. to 5 p.m. On Fridays, Saturdays, and Sundays the lighthouse reopens from 7 p.m. to 9 p.m. Call (906) 437-5272 to confirm the hours"
-82.793338,44.022826,"Pointe Aux Barques Lighthouse-Lighthouse County Park,MI","Grounds open, dwelling open in season, tower closed. open daily, 10 a.m. to 8 p.m., from Memorial Day weekend to the last weekend in September. The tower is closed to the public."
-82.982473,44.082064,"Port Austin Reef Lighthouse-2.5 miles offshore-Port Austin,MI",Best seen by boat. Tower closed. Can be seen from many points along the shore near Port Austin
-82.53992,43.42876,"Port Sanilac Lighthouse-Port Sanilac,MI",Privately owned. Grounds/dwelling/tower closed. The breakwater extending from Cherry Street is a nice place from which the lighthouse can be photographed
-88.431125,46.968779,"Portage River Entry Light-Jacobsville,MI","Grounds open, tower closed. you can walk out on the pier to the Portage River Entry Lighthouse"
-86.663,45.5212,"Poverty Island Light-Poverty Island,MI",Best seen by boat. Grounds/Tower closed
-83.492128,45.356498,"Presque Isle Lighthouse(New)-Presque Isle Peninsula,MI","Grounds open, dwelling/tower open in season. open for climbing from mid-May to mid-October, seven days a week, from 9 a.m. to 6 p.m. For more information, you can reach the lighthouse at (989) 595-9917"
-83.478078,45.342008,"Presque Isle Light (Old)-Presque Isle Peninsula,MI","Grounds open, dwelling/tower open in season.open from mid-May to mid-October, seven days a week, from 9 a.m. to 6 p.m. The keeper's dwelling houses a museum, and visitors are allowed to climb the detached tower,  For more information, you can reach the lighthouse at (989) 595-6979."
-87.375,46.575,"Presque Isle Harbor Breakwater Light-Presque Isle,MI","Grounds open, Tower closed. One can walk the breakwater to the light"
-83.4843,45.3435,"Presque Isle Range Lights-Presque Isle,MI","The front range light is owned by Presque Isle Township, while the rear range light is privately owned. Neither of the lights is open for climbing."
-86.06748,44.81332,"Robert H. Manning Memorial Light-Village Park,MI","Grounds open, Tower closed"
-88.58059,48.0897,"Rock Harbor Lighthouse-Isle Royale National Park,MI","Grounds open, tower open in season.The Edisen Fishery/Rock Harbor Lighthouse trip is offered on Thursdays and Saturdays during the summer months. Public transportation to Isle Royale is offered from Michigan and Minnesota. "
-89.3133,47.8667,"Rock Of Ages Lighthouse-Isle Royale National Park,MI",Tower. Near Isle Royale National Park
-84.616623,45.837173,"Round Island Lighthouse-near Mackinac Island,MI","Best seen by boat. Grounds open, Tower closed"
-84.0196,46.1088,"Round Island (St. Mary's River) Lighthouse-Round Island in St Mary's River,MI",Privately owned. Grounds/Tower/dwelling closed. Best seen from St Mary's River
-84.615224,45.843012,"Round Island Passage Light-near Mackinac Island,MI",Best seen by boat. Tower closed. Near Round Island Lighthouse
-83.8534,43.6366,"Saginaw River Rear Range Lighthouse-Bay City,MI",Grounds/Tower/dwelling closed. Presently ungoing restoration
-88.3703,47.3919,"Sand Hills Lighthouse-8 miles north-Ahmeek,MI","Grounds open, dwelling/tower open for overnight guests. (906) 337-1744"
-88.4672,46.7836,"Sand Point (Baraga) Lighthouse-Baraga,MI","Grounds open, Tower/dwelling closed. "
-87.0447,45.7448,"Sand Point (Escanaba) Lighthouse-Escanaba,MI","Grounds open, dwelling/tower open in season.The lighthouse is open daily during June, July, and August from 9 a.m. to 5 p.m., and from 1 p.m. to 5 p.m. in September. For more information, call (906) 786-3763"
-85.912304,45.921388,"Seul Choix Point Lighthouse-Seul Choix Point,MI","Grounds open, tower/dwelling open in season.The lighthouse is open daily from 10 a.m. to 6 p.m., Memorial Day through mid-October. Call (906) 283-3183 for more information"
-85.172318,45.676258,"Skillagalee Island (Iie Aux Galets) Light-7 miles offshore-Cross Village,MI",Must be seen by boat. Tower closed
-85.8361,45.3798,"South Fox Island Lighthouse-South Fox Island,MI","Must be seen by boat. Grounds open, Tower/dwelling closed"
-86.28796,42.401418,"South Haven South Pier Light-South Haven,MI","Grounds open, tower open the weekend of Harborfest.you can walk the pier to the South Haven Lighthouse. "
-86.288201,42.401974,"South Haven North Pier Light-South Haven,MI","Grounds open, you can walk the pier to the light."
-86.093787,45.00783,"South Manitou Island Lighthouse-South Manitou Island,MI","Grounds open, dwelling closed, tower open in season for tours. Ferry reqd to reach South Manitou Island (231) 326-5134 "
-84.1367,45.7732,"Spectacle Reef Lighthouse-10 miles offshore-Bois Blanc Island,MI",Must be seen by boat. Tower closed
-85.588,45.8393,"Squaw Island Lighthouse-Squaw Island,MI","Privately owned. Grounds/dwelling/tower.vegetations limits views from the water, Squaw Island Lighthouse is best seen from the air"
-82.68985,42.53759,"St.Clair Flats Old Channel Range Light-Lake St Clair,MI","Towers closed. best seen from the water, but are also visible from Harsens Island. To reach the island, take the ferry from Algonac,"
-84.8645,45.855,"St.Helena Island Light-St Helena Island,MI",Must be seen by boat.  Grounds/dwelling/tower open on GLLKA tours. 231-436-5580
-84.715427,45.865943,"St.Ignace Light (replica)-St Ignace,MI",Walk the pier to the lighthouse
-86.493576,42.116083,"St.Joseph's North Pier Lighthouse-St Joseph's,MI","Grounds open, Towers closed. You can walk the pier to the lighthouses"
-86.494648,42.116333,"St Joseph's North Pier Outer Light-St Joseph's,MI","Grounds open, Towers closed. You can walk the pier to the beacon"
-86.494367,42.115248,"St Joseph's South Pier Beacon-St Joseph's,MI","Grounds open, Towers closed. You can walk the pier to the lighthouses"
-86.7586,45.5049,"St. Martin Island Light-St Martin Island,MI",Must be seen by boat. Grounds/Tower/dwelling closed
-87.225,47.1834,"Stannard Rock Lighthouse-way offshore-Lake Superior,MI",Must be seen by boat. Tower closed
-83.272678,44.712703,"Sturgeon Point Lighthouse-Harrisville,MI","Grounds open, dwelling/tower open in season. The keeper's house is now a maritime museum which is open to the public from noon to 3 p.m., Monday though Thursday, and from 11 a.m. to 4 p.m., Friday through Sunday. The tower is open from noon to 3 p.m., Friday through Sunday, during the same period"
-83.449531,44.253794,"Tawas Point Lighthouse-Tawas Point State Park,MI","Grounds open, dwelling/tower open in season. The lighthouse is open for tours on weekends Memorial Day through Labor Day. During the tour you can walk to the top of the tower for a spectacular view .  For tour information, call (989) 362-5658. "
-83.1943,45.0369,"Thunder Bay Lighthouse-Thunder Bay Island,MI","Must be seen by boat. Grounds open, Tower/dwelling closed"
-85.1324,45.8101,"Waugoshance Shoal Light-offshore from Waugoshance Island,MI",Must be seen by boat. Tower closed
-86.423924,43.374806,"White River Lighthouse-White River to Lake Michigan,MI","Grounds open, dwelling/tower open in season.The White River Lighthouse is open from June 1 through October 31. For hours, visit their website or call (231) 894-8265"
-86.429057,43.37553,"White River North Pier Light-White River to Lake Michiga,MI",Light is at the end of the pier.
-86.429564,43.374938,"White River South Pier Light-White River to Lake Michigan,MI",Light is at the end of the pier.
-85.1349,45.8417,"White Shoal Lighthouse-20 miles offshore of Mackinac Bridge,MI",Must be seen by boat. Tower closed
-84.957436,46.771118,"Whitefish Point Lighthouse-Whitefish Point,MI","Grounds open, dwelling open in season, tower closed.open daily from May 1st to October 31st from 10 a.m. to 6 p.m. For more information, call 877-SHIPWRECK"
-82.9542,42.347,"William Livingstone Memorial Light-Belle Isle Island,MI","Grounds open, Tower closed"
-82.92983,42.35812,"Windmill Point Light-Detroit,MI","Grounds open, Tower closed"
-92.088,46.7806,"Duluth Harbor North Breakwater Light-Duluth,MN","Grounds open, Tower closed"
-92.0919,46.7782,"Duluth Harbor South Breakwater Inner Light-Duluth,MN","Grounds open, Tower closed"
-92.0869,46.7795,"Duluth Harbor South Breakwater Lighthouse Outer-Duluth,MN","Grounds open, Tower closed"
-90.3383,47.745,"Grand Marais Harbor Light-Grand Maraie,MN","Grounds open, Tower closed"
-90.340305,47.744396,"Grand Marais Breakwater Light-Grand Marais,MN","Grounds open, Tower closed"
-92.0227,46.7094,"Minnesota Point Light(Ruins)-Duluth,MN","Grounds open, Tower closed. Requires a 1.5 mile hike"
-91.3671,47.19985,"Split Rock Lighthouse-Split Rock State Park,MN","Grounds open, tower/dwelling open in season. From May 15 - October 15, the lighthouse buildings and visitor center are open daily from 10 a.m. to 6 p.m. During the rest of the year, the visitor center is open Thursday through Monday, from 11 a.m. to 4 p.m. while the lighthouse buildings are closed. Call (218) 226-6372"
-91.6695,47.01038,"Two Harbors Breakwater Light-Two Harbors,MN","Grounds open, Tower closed. Walk the breakwater to the light"
