-88.01165,30.43745,"Mobile Bay Lighthouse-Mobile Bay,AL",Located near the middle of Mobile Bay. Best seen by boat. Lighthouse is closed
-88.023583,30.227318,"Mobile Point Light-Fort Morgan,AL",Located on the grounds of Fort Morgan(251) 540-7127. Lighthouse presently in storage for restoration. Schedule for restoration last part of 2015.
-88.05056,30.18778,"Sand Island Lighthouse-Sand Island,AL","Located Mobile Bay/Gulf of Mexico. Visible from Fort Morgan(Mobile Point), but best seen by boat. Not open to public"
-134.13597,56.00145,"Cape Decision Lighthouse-Kuiu Island,AK","Lighthouse is a hard one to reach.Grounds open, tower/dwelling open by arrangement with Cape Decision Lighthouse Society. Contact them at capedecisionlighthouse@yahoo.com"
-146.6466,60.2383,"Cape Hinchinbrook Lighthouse-Hinchinbrook Island,AK",Best seen by boat. Grounds/Tower closed
-164.927526,54.598242,"Cape Sarichef Lighthouse-Unimak Island,AK",Best seen by boat. Grounds/Tower closed. Skeletal tower replaced the buildings.
-136.64,58.1984,"Cape Spencer Lighthouse-Cape Spencer,AK",Best seen by plane. Grounds/Tower closed
-144.5983,59.7983,"Cape St Elias Lighthouse-Kayak Island,AK","The Cape St Elias Lightkeepers Association conducts a ""Lighthouse School"" at the lighthouse and can also arrange for overnight stays at the lighthouse. Grounds open, dwelling/Tower closed. (907) 424-5182"
-135.22,58.9717,"Eldred Rock Lighthouse-Eldred Rock,AK",Best seen by boat. Grounds/Tower/dwellings closed
-133.6322,57.2698,"Five Finger Lighthouse-Five Finger Islands,AK","The lighthouse is owned by the Juneau Lighthouse Association. Grounds open, tower/dwelling open by arrangement with Juneau Lighthouse Association.email to info@5fingerlighthouse.com"
-131.8817,55.4466,"Guard Island Lighthouse-Guard Island,AK","Can be viewed by car. North of Ketchikan , 11 miles to South Point Higgins Road. Grounds/Tower closed"
-131.6594,55.3325,"Lightship Umatilla-Ketchikan,AK",Lightship gets moved on occasion. Privately owned. Closed
-131.1826,55.09904,"Mary Island Lighthouse-Mary Island,AK",Can be seen by boat. Grounds/Tower closed
-145.76288,60.53714,"Minor Light of Alaska-Odiak Pharos,AK","Privately owned. Grounds open, Tower closed"
-134.9559,58.4087,"Point Retreat Lighthouse-Admiralty Island,AK","The lighthouse is owned by the Alaska Lighthouse Association. Grounds open, dwelling/tower open by arrangement with Alaska Lighthouse Association.email info@aklighthouse.org "
-135.1517,58.855,"Point Sherman Light-Point Sherman,AK",Can be seen by boat. Grounds/dwelling closed
-134.922605,58.546152,"Sentinel Island Lighthouse-Sentinel Island,AK","The best way to see the lighthouse, however, is on an overnight stay that can be arranged through the Gastineau Channel Historical Society by calling 907-586-5338. "
-130.933967,54.802876,"Tree Point Lighthouse-Misty Fjords National Monument,AK",Must be seen by boat. Grounds/Tower/dwelling closed
-122.4222,37.8262,"Alcatraz Island Lighthouse-Alcatraz Island,CA","Grounds open, tower closed. A trip to Alcatraz can be arranged through Alcatraz Cruises either by using their website or by calling them at (415) 981-ROCK"
-119.3584,34.0156,"Anacapa Island Lighthouse-Anacapa Island,CA","Grounds open, tower closed.Trips to Anacapa Island are offered year-round call them at (805) 642-1393"
-122.336,37.1078,"Ano Nuevo Lighthouse-Ano Nuevo Island,CA",Grounds/dwelling closed.  5 mile round trip hike is reqd to view the lighthouse. The keepers dwellings are dilapidated and the tower has toppled.
-117.195475,32.752,"Ballast Point Lighthouse-Ballast Point,CA","The Lantern room is on display outside the West Sea Company . 2495 Congress St, San Diego,CA."
-124.2032,41.744,"Battery Point Lighthouse-Crescent City,CA","Grounds open, dwelling/tower open in season. Open April through September, tides permitting, between the hours of 10 am and 4 pm, Wednesday through Sunday. You can call (707) 464-3089 during these hours to learn when the tide permits access to the island."
-124.0694,40.0225,"Cape Mendocino Lighthouse-Shelter Cove,CA","Grounds open, tower open in season.open to the public Memorial Day to Labor Day, seven days a week, from 10:30 a.m. to 3:30 p.m. (subject to availability of docents). For the passport stamp after hours, call Roger Boedecker at (707) 986-1611"
-122.2125,38.0682,"Carquinez Strait Lighthouse-Vallejo,CA","Grounds open, dwelling open. Glen Cove Marina can be reached at (707) 552-3236"
-122.433,37.9633,"East Brother Lighthouse-Point San Pablo,CA","Grounds/dwelling/tower open to guests.operates as a bed and breakfast, and guests are transported to the island by boat from the Point San Pablo Yacht Harbor. A day trip to the lighthouse is possible on Saturdays during the summer. Call (510) 233-2385 to make reservations"
-123.001645,37.698895,"Farallon Island Lighthouse-Farallon Islands,CA",Grounds/dwellings/tower closed. 30 miles offshore.
-122.4771,37.8108,"Fort Point Lighthouse-San Francisco,CA","Grounds open, tower closed. The top level of the fort is currently closed to visitors, but even when it is open, visitors are not allowed inside the lighthouse"
-124.221,40.7691,"Humbolt Harbor Lighthouse-Humbolt Bay,CA","Ruins only. The lighthouse's cupola can be seen at the Humbolt Bay Maritime Museum located next to the Samoa Cookhouse. Phone: (707) 444-9440. The museum is open Tuesday through Saturday, 11 a.m. - 4 p.m. in season. "
-122.47856,37.82557,"Lime Point Lighthouse-Sausalito,CA","Grounds closed. The best way to see the remains of this station is by boat, however, you can get fairly close to it on land by going north over the Golden Gate Bridge, taking the first or second exit after the bridge and winding down to the base of the bridge."
-118.1868,33.72322,"Long Beach Harbor Light-Long Beach,CA",Grounds/tower closed. This light is definitely best viewed from a boat.
-118.2512,33.7088,"Los Angeles Harbor Lighthouse [Angel's Gate]-San Pedro,CA","Grounds open, tower closed. You can park and walk the breakwater to the Los Angeles Harbor Lighthouse."
-122.5102,37.7927,"Mile Rocks Lighthouse-San Francisco,CA",Tower closed. Can be seen from Lincoln Park
-117.24249,32.6651,"New Point Loma Lighthouse-Point Loma,CA",Grounds/tower/dwellings closed. Can be seen from a point near Old Point Loma LH in Cabrillo National Monument.
-122.2434,37.7809,"Oakland Harbor Lighthouse-Oakland,CA","Grounds and dwelling open, tower closed.Call (510) 536-2050 for hours"
-117.24086,32.67171,"Old Point Loma Lighthouse-Point Loma,CA","Grounds/dwelling open, tower open two days a year. Only open to the public on November 15th (the anniversary of the first lighting) and August 25th (the birthday of the National Park Service)."
-121.2849,35.665,"Piedras Blancas Lighthouse-Piedras Blancas,CA","Grounds/tower open during tours, dwellings closed.Tours of the lighthouse are offered on the third Saturday of each month and originate at the Hearst Castle State Historic Monument Visitor Center. For more information on the tours, call (805) 927-6811"
-122.39353,37.18185,"Pigeon Point Lighthouse-Pigeon Point,CA","Grounds open, dwellings open to hostel guests, tower currently closed.For recorded information on the lighthouse, call (650) 879-2120"
-123.7406,38.9546,"Point Arena Lighthouse-Point Arena,CA","Grounds open, dwellings open to overnight guests, tower open during tours.open daily from 10 a.m. to 3:30 p.m. Visitors are welcome to climb the tower. call (877) 725-4448"
-120.6475,34.5778,"Point Arguello Lighthouse-Point Arguello,CA",Grounds closed.access to the point is generally not granted to the public
-122.42,37.8533,"Point Blunt Lighthouse-Angel Island,CA",Grounds/dwelling/tower closed. Ferry ride to Angel Island reqd. 
-122.5297,37.8155,"Point Bonita Lighthouse-Point Bonita,CA","Grounds open during tours, tower closed.open Saturdays, Sundays and Mondays from 12:30 p.m. to 3:30 p.m. For more information on visiting the lighthouse or to make a reservation for a full-moon tour, call (415) 331-1540. The interior of the lighthouse is typically accessible, but not the tower"
-123.8261,39.3487,"Point Cabrillo Lighthouse-Point Cabrillo,CA",Grounds/dwelling/tower open.open daily from 9:00 a.m. to sunset. The lighthouse and lightkeeper's home are open daily from 11:00 a.m. to 4:00 p.m. The tower is not open for climbing
-120.4707,34.449,"Point Conception Lighthouse-Point Conception,CA","Grounds/tower closed.The land surrounding the Point Conception Lighthouse is part of the huge, privately-owned Cojo Jalama Ranch, and is thus not accessible to the public. "
-122.49965,37.82,"Point Diablo Light-Point Diablo,CA","Grounds/tower closed.This light is best viewed from the water, although views can also be had from the coastal road in the Marin Headlands"
-118.2937,33.7053,"Point Fermin Lighthouse-Point Fermin,CA","Grounds open, dwelling open during tours, tower closed. open for tours Tuesday through Sunday between 1:00 and 4:00 p.m. For more information, you can reach the Point Fermin Lighthouse at (310) 241-0684. "
-119.2098,34.145,"Point Hueneme Lighthouse-Point Hueneme,CA","Grounds/tower open during tours.open house at Point Hueneme Lighthouse on the 3rd Saturday of the month from 10 a.m. to 3 p.m. from February through October. During this time, visitors can walk to the lighthouse using the Lighthouse Promenade and gain access to the lighthouse. For recorded tour information, call (310) 541-0334. "
-122.4423,37.8561,"Point Knox Lighthouse-Point Knox,CA",Grounds closed. Remains only. Ferry reqd to Angel Island
-122.519,37.5363,"Point Montara Lighthouse-Point Montara,CA","Grounds open, tower closed, fog signal building and Coast Guard dwelling open to guests.further information, call (650) 728-7177.  "
-121.93348,36.63357,"Point Pinos Lighthouse-Point Pinos,CA","Grounds open, lighthouse open. For more information regarding the lighthouse, call (831) 648-5716 ext. 13. "
-123.02327,37.9957,"Point Reyes Lighthouse-Point Reyes,CA","Grounds open, tower open.open all year, Thursday through Monday from 10 a.m. to 4:30 p.m. Special, evening illuminations of the lens occur on the first and third Saturdays of each month, April through December. Reservations are required for these tours and can be made by calling (415) 669-1534. "
-121.9016,36.3063,"Point Sur Lighthouse-Point Sur,CA",Grounds/dwelling/tower open during tours.  Docent-led tours of Point Sur State Historic Park are offered on weekends (Saturdays at 10 a.m. and 2 p.m. and Sundays at 10 a.m.) contact the lighthouse at (831) 625-4419.
-118.4106,33.7419,"Point Vicente Lighthouse-Point Vicente,CA","Grounds/tower open during tours. Dwellings closed.second Saturday of each month when the tower and a small museum in the fog signal building are open for tours between the hours of 10 a.m. and 3 p.m. In March, the lighthouse is open on the first Saturday instead. call (310) 541-0334"
-124.3503,40.2493,"Punta Gorda Lighthouse-Punta Gorda,CA",Grounds/tower open. hike south along the beach for just over three miles .This is a strenuous hike
-122.2804,37.7956,"Relief Lightship-Oakland,CA","Grounds open, ship open for tours. open Friday, Saturday and Sunday from 11 a.m. to 4 p.m. For more information, call (510) 272-0544. "
-124.38652,41.83662,"St George Reef Lighthouse-St George Reef,CA",Tower open during helicopter tours. Can be seen from Point St George
-120.76,35.1601,"San Luis Obispo Lighthouse-San Luis Head,CA",Grounds/lighthouse open during scheduled hikes.call (805) 540-5771
-119.7232,34.3958,"Santa Barbara Lighthouse-Santa Barbara,CA","Grounds/tower closed.Distant views of the light are available from areas around the compound, which is closed to the public. "
-122.0023,36.9604,"Santa Cruz Breakwater(Walton) Lighthouse-Santa Cruz,CA","Grounds open, tower closed. Walk the breakwater to the light"
-122.0268,36.9515,"Santa Cruz Lighthouse-Santa Cruz,CA","Grounds open, lighthouse open during museum hours, tower closed.Between July 4 and mid-September the museum is open Wednesday through Monday from 10 a.m. to 5 p.m. The rest of the year, museum hours are noon to 4 p.m., Thursday through Monday. (831) 420-6289"
-121.4942,38.0359,"Southhampton Shoals Lighthouse-Tinsley Island,CA","Grounds/dwelling/tower closed.You must have permission to land on Tinsley Island, and access to the lighthouse is typically limited to guests staying in the lighthouse. "
-124.1654,40.8081,"Table Bluff Lighthouse-Woodley Island,CA","Grounds open, tower closed. (707) 444-9440"
-124.1514,41.0518,"Trinidad Head Lighthouse-Trinidad,CA",Grounds/dwelling/tower closed.
-124.1431,41.058,"Trinidad Head Memorial Light-Trinidad,CA","Grounds open, tower closed."
-122.3625,37.8073,"Yerba Buena Lighthouse-Yerba Buena Island,CA",Grounds/dwelling/tower closed. The lighthouse and keepers' quarters are on Coast Guard property and are not open to the public
-72.067,41.3196,"Avery Point Lighthouse-Groton,CT","Lighthouse is owned and is on the University of Conn. At Avery Point.Grounds open, Tower closed. New London Harbor and New London Ledge Lighthouses can be seen from the campus"
-72.6533,41.2117,"Faulkner's Island Lighthouse-Faulkner's Island,CT","Best seen by boat. Grounds/Tower closed. However, each fall an open house is held. (203) 453-8400"
-73.2167,41.1424,"Fayerweather Island Lighthouse-Fayerweather Island,CT","Light can be reached by walking the breakwater. Grounds open, Tower closed"
-72.9039,41.2483,"Five Mile Point Lighthouse-New Haven,CT","Grounds open, Tower/dwelling closed"
-73.6235,40.9825,"Great Captain Island Lighthouse-Great Captain Island,CT","The ferry that provides access to the island only runs during the summer and is restricted to local residents holding a park pass and their guests. Grounds open, Tower/dwelling closed"
-73.4434,41.0417,"Greens Ledge Lighthouse-Greens Ledge,CT",Best seen by boat. Tower closed
-72.343254,41.271373,"Lynde Point lighthouse-Saybrook,CT","The lighthouse is located at the end of a private road, but distant views can be had from Neponset Avenus. Grounds/Tower/dwelling closed"
-71.9894,41.3167,"Morgan Point Lighthouse-Mystic Harbor,CT","Best seen from the water. Privately owned, Grounds/Tower/dwelling closed"
-71.9664,41.3614,"Mystic Seaport Lighthouse-Mystic,CT","Located on the grounds of Mystic Seaport. Grounds open, Tower closed"
-72.08997,41.31666,"New London Harbor Lighthouse-New London,CT","Best seen from the water. Privately owned, Grounds/Tower/dwelling closed"
-72.077286,41.306121,"New London Ledge Lighthouse-New London,CT",Best seen by boat. Dwelling/Tower open during tours.(860) 445-9007
-73.3683,41.0783,"Peck Ledge Lighthouse-Norwalk Harbor,CT",Best seen by boat. Tower closed
-73.2218,41.1163,"Penfield Reef Lighthouse-Fairfield,CT",Best seen by boat. Dwelling/Tower closed
-72.34276,41.2632,"Saybrook Breakwater Lighthouse-Old Saybrook,CT",Best seen by boat. Tower closed
-73.4144,41.0526,"Sheffield Island Lighthouse-Sheffield Island,CT","Grounds open, dwelling/tower open in season. Contact Norwalk Seaport Association (203)838-944 for details"
-72.9116,41.235,"Southwest Ledge Lighthouse-New Haven,CT",Best seen by boat. Tower closed
-73.5433,41.0133,"Stamford Harbor Ledge Lighthouse-Stamford,CT","Best seen by boat. Privately owned, Tower closed"
-71.9056,41.3276,"Stonington Harbor Lighthouse-Stonington,CT","Open daily from 10 a.m. to 5 p.m., from May through October. Grounds open. Tower/dwelling open in season.  (860) 535-1440."
-73.1033,41.1517,"Stratford Point Lighthouse-Stratford Point,CT",Grounds/Tower/dwelling closed
-73.1016,41.06,"Stratford Shoal Lighthouse-Stratford Shoal,CT",Best seen by boat. Dwelling/Tower closed
-73.1803,41.1687,"Tongue Point Lighthouse-Bridgeport,CT",Tower closed
-75.5701,39.5416,"Baker Rear Range Light-Port Penn,DE",Tower closed
-75.5181,39.7201,"Bellevue Rear Range Light-Wilmington,DE",Accessed thru Cherry Island Landfill. Call (302) 764-2732 to see if visits are still permitted. Tower closed
-75.48973,39.76207,"Cherry Island Range Light-Cherry Island,DE",Grounds open. Tower closed
-75.1003,38.7972,"Delaware Breakwater Lighthouse-Cape Henlopen State Park,DE",Can be seen from Cape Henlopen State Park. Info on tours by calling (302) 644-7046. Grounds/Tower are open during special tours
-75.169,38.7896,"Delaware Breakwater Rear Range(Green Hill)Light-Lewes,DE",Remains only. Grounds open
-75.0548,38.4514,"Fenwick Island Lighthouse-Fenwick Island,DE",Grounds open. Tower closed
-75.18356,39.04816,"Fourteen Foot Bank Lighthouse-Delaware Bay,DE","Best seen from the water. Privately owned, Tower closed"
-75.09361,38.8147,"Harbor of Refuge Lighthouse-Lewes,DE",Distant view from Cape Henlopen State Park. Part of Delaware Breakwater Lighthouse tour (302) 644-7046 
-75.147,38.779,"Lightship Overfalls-Lewes,DE",Grounds open. Ship open during Jun-Aug on Fri/Sat from 10 am to 4 pm and Sun from 1 pm to 4 pm
-75.592,39.4829,"Liston Front Range Lighthouse-Fort Penn,DE",Privately owned. Grounds/Tower/dwelling closed. View from Route 9
-75.639,39.5239,"Liston Rear Range Light-Biddle's Corner,DE",Grounds/Tower/dwellings closed
-75.5031,39.76212,"Marcus Hook Rear Range Lighthouse-Gordon Heights,DE",Grounds/Tower/dwellings closed
-75.3149,38.9472,"Mispillion Lighthouse-Slaughter Beach,DE",Iron Tower has replaced the lighthouse
-75.5954,39.6423,"New Castle Range Light-New Castle,DE",Grounds/Tower/dwellings closed
-75.5898,39.4064,"Reedy Island Rear Range Light-Taylor's Bridge,DE",Grounds/Tower closed
-80.6183,24.85167,"Alligator Reef Lighthouse-Alligator Reef,FL",3 miles offshore. Best seen by boat. Tower closed
-81.442466,30.673149,"Amelia Island Lighthouse-Fernandina Beach,FL","Tours are offered on the first and third wednesdays of the month. (904) 277-7350. Grounds open during tours,tower closed"
-81.52,24.525,"American Shoal Lighthouse-American Shoals,FL",6.5 miles offshore. Best seen by boat. Tower closed
-82.8458,28.168,"Anclote Key Lighthouse-Anclote Key,FL","3 miles offshore. Assessible by boat. Grounds open, Tower closed"
-82.2635,26.7419,"Boca Grande Entrance Rear Range Light-Gasparilla Island,FL","Grounds open, Tower closed"
-80.156,25.6666,"Cape Florida Lighthouse-Key Biscayne,FL","Open for tours at 10 am and 1 pm, Thursday thru Monday. Call (305) 361-5811"
-80.5435,28.4602,"Cape Canaveral Lighthouse-Cape Canaveral,FL","Cape Canaveral AFS Tours. Grounds open during tours and the first four levels of the tower are open. Call 321-494-5945 for reservations and schedule. Tour includes admission to the Exploration Tower, Air Force Space and Missile History Center and 2 historic launch complexes."
-85.3564,29.671,"Cape San Blas Lighthouse-Cape San Blas,FL","Grounds open, Tower/dwellings closed"
-85.04685,29.5878,"Cape St George Lighthouse-Little St George Island,FL",Destroyed. Reconstructed on St George Island
-84.86284,29.66316,"Cape St George Lighthouse-St George Island,FL",Reconstruction complete. Tower is open for visitors. Call (850) 927-7744
-80.21167,25.22167,"Carysfort Reef Lighthouse-Carysfort Reef,FL",Offshore. Best seen by boat. Tower closed
-83.06533,29.09648,"Cedar Keys(Seahorse Key) Lighthouse-Seahorse Key,FL",Accessible by boat.Open to the public the first Sat in July and 3rd weekend in Oct. Grounds/dwelling/tower open during tours
-84.701007,29.827188,"Crooked River Light-Carabelle Beach,FL","Grounds open,Tower closed"
-82.920596,24.63331,"Dry Tortugas(Loggerhead Key) Lighthouse-Loggerhead Key,FL","Accessible by boat. Grounds open, Tower closed"
-82.7607,27.6003,"Egmont Key Lighthouse-Egmont Key,FL","Accessible by boat. Grounds open, Tower closed"
-80.0965,25.5899,"Fowery Rocks Lighthouse-Fowery Rocks,FL",6.5 miles offshore. Best seen by boat. Tower closed
-82.87228,24.628202,"Garden Key (Ft Jefferson) Lighthouse-Fort Jefferson,FL","Accessible by boat. Grounds open, Tower closed"
-80.0808,26.2591,"Hillsboro Inlet Lighthouse-Pompano Beach,FL","Occasional tours by Hillsboro Lighthouse Preservation Society. Grounds/Tower open,dwellings closed"
-80.082103,26.948646,"Jupiter Inlet Lighthouse-Jupiter,FL",Tours are offered Tuesday thru Sunday from 10-5. Grounds/Tower open during tours. (561) 747-8380
-80.4349,25.0872,"Key Largo Lighthouse-Key Largo,FL",Lighthouse is privately owned. Grounds/Tower closed
-81.8007,24.5506,"Key West Lighthouse-Key West,FL","Grounds/Tower/dwelling open daily, 9:30 am to 4:30 pm, (305) 294-0012"
-82.921,24.633,"Loggerhead Key Lighthouse-Loggerhead,FL",Accessible by boat.
-87.3084,30.3458,"Pensacola Lighthouse-Pensacola,FL","Grounds/Tower/dwelling open on Saturdays from Noon to 4:00 pm, May thru Oct. (850) 916-7864"
-80.9281,29.0803,"Ponce de Leon Inlet Lighthouse-Ponce Inlet,FL","Grounds/Tower/dwellings open daily 10 am until 6 pm (Labor Day until Memorial Day), 10 am until 9 pm (Mem day to Labor day),  (386) 761-1821"
-82.2608,26.7173,"Port Boca Grande(Gasparilla Island) Lighthouse-Port Boca Grande,FL","Grounds/Tower are open seven days a week November through April from noon to 4 p.m. From May through October, open Mon - Fri from 10 am to 4 pm, (941) 964-0060"
-81.8755,24.4534,"Sand Key Lighthouse-Sand Key,FL",8 miles offshore. Best seen by boat. Grounds open/Tower closed
-82.0141,26.45271,"Sanibel Island Lighthouse-Sanibel Island,FL","Grounds open, Tower/dwellings closed."
-81.111,24.6278,"Sombrero Key Lighthouse-Sombrero Key,FL",7 miles offshore. Best seen by boat. Tower closed
-81.28877,29.88548,"St Augustine Lighthouse-St Augustine Beach,FL","Grounds/Tower/dwellings, open daily at 9:00 am to 6:00 pm, July 9:00 am to 7 pm, (904) 829-0745"
-81.3981,30.3861,"St Johns Lighthouse-Mayport,FL","Mayport NAS. Grounds open by permission of Navy,Tower closed"
-81.4259,30.3935,"St Johns River Lighthouse-Mayport,FL","Mayport NAS. Grounds open by permission of Navy,Tower closed"
-85.303,29.7603,"St Joseph Point Lighthouse-Port St Joe,FL",Privately owned. Grounds/dwelling closed
-84.179,30.0739,"St Marks Lighthouse-St Marks,FL","Grounds open, Tower closed"
-80.880052,32.022681,"Cockspur Island Lighthouse-Cockspur Island,GA",Wade through marshes or a trip on a boat. Grounds/Tower open
-81.4191,30.97228,"Little Cumberland Island Lighthouse-Little Cumberland Island,GA",View by boat reqd. Access to Island is restricted to home owners and guests. Grounds/Tower closed. (912) 265-0392
-81.393585,31.134095,"Saint Simons Lighthouse-Saint Simons Island,GA","Open Mon thru Sat 10:00 am to 5:00 pm, Sun 1:30 pm to 5:00 pm. Grounds/Tower/dwelling open. (912) 638-4666"
-81.284143,31.389894,"Sapelo Island Front Range Light-Sapelo Island,GA","30 minute ferry ride and 4 hour tour of the island are reqd. Tours Sat at 9:00 am,June thru Labor Day,Fri at 8:30 am Grounds/Tower closed. (800) 864-7275"
-81.285682,31.391237,"Sapelo Island Lighthouse-Sapelo Island,GA","30 minute ferry ride and 4 hour tour of the island are reqd. Tours Sat at 9:00 am,June thru Labor Day,Fri at 8:30 am Grounds/Tower open. (800) 864-7275"
-81.084286,32.079308,"Savannah Harbor Light-Savannah,GA",Grounds open
-80.845655,32.022228,"Tybee Island Lighthouse-Tybee Island,GA","Open every day except Tuesday, from 9:00 am to 4:30 pm. Grounds/Tower/dwellings open. (912) 786-5801"
-158.1082,21.2995,"Barbers Point Lighthouse-Barbers Point,HI","Grounds open, tower closed"
-154.8135,19.5195,"Cape Kumukahi Light-Cape Kumukahi,HI","Grounds open, tower closed.Lighthouse is 6.8 miles farther down the road. Before reaching the lighthouse, the road becomes dirt and is quite rough."
-157.8107,21.2585,"Diamond Head Lighthouse-Diamond Head,HI","Grounds/dwelling/tower closed.Being part of a private residence, the lighthouse grounds are not open to the public. Good, distant views of the grounds can be had from atop the crater at Diamond Head State Monument"
-155.7734,20.249,"Kauhola Point Lighthouse-Kauhola Point,HI","Grounds open, tower closed.you can park and walk the last mile or so. "
-159.4049,22.2355,"Kilauea Lighthouse-Kilauea Point,HI","Grounds open, dwellings/tower closed.open daily from 10 a.m. to 4 p.m. and can be reached at (808) 828-1413."
-156.6813,20.875,"Lahaina Lighthouse-Lahaina Harbor,HI","Grounds open, tower closed."
-157.6522,21.3125,"Makapu'u Lighthouse-Makapu'u Head,HI","Nearby area open, tower closed. The tower and the area right around the tower are not open to the public, but you can get a great view from a point just above the lighthouse. "
-156.9699,21.2091,"Moloka'I Lighthouse-Kalaupapa Peninsula,HI","Grounds closed, tower closed. you can arrange for a tour by calling Damien Tours directly at (808) 567-6171."
-159.3361,21.9558,"Nawiliwili Lighthouse-Lihue,HI","Grounds open, tower closed. tell the guard you want to visit the Nawiliwili Lighthouse and follow the road as it skirts the airport runway, cuts through a golf course and leads you to the base of the lighthouse. "
-156.00107,19.63784,"Minor light of Hawai'i-Kailua,HI","Grounds open, tower closed.You can walk the shoreline to the light"
-155.83287,20.04145,"Minor light of Hawai'i-Kawaihae,HI","Grounds open, tower closed."
-156.06125,19.72794,"Minor light of Hawai'i-Keahole Point,HI","Grounds open, tower closed"
-155.556,20.12793,"Minor light of Hawai'i-Kukuihaele,HI",Grounds/tower closed
-155.24051,19.99379,"Minor light of Hawai'i-Laupahoehoe Point,HI","Grounds open, tower closed. "
-155.90151,20.18034,"Minor light of Hawai'i-Mahukona,HI","Grounds open, tower closed."
-155.0899,19.76224,"Minor light of Hawai'i-Pauka'a Point,HI",Grounds/tower closed
-155.0828,19.84729,"Minor light of Hawai'i-Pepe'ekeo Point,HI","Grounds open, tower closed."
-155.08621,19.72689,"Minor light of Hawai'i-Coconut Point,HI","Grounds open, tower closed."
-155.68191,18.91224,"Minor light of Hawai'i-Ka Lae,HI","Grounds open, tower closed."
-155.93601,19.47917,"Minor Light of Hawai'i-Napo'opo'p,HI","Grounds open, tower closed"
-156.6664,20.5019,"Minor light of Kaho'olawe-Kaho'olawe,HI ",Grounds/tower closed
-159.60432,21.89293,"Minor light of Kaua'i-Hanapepe,HI","Grounds open, tower closed"
-159.29556,22.14684,"Minor light of Kaua'i-Kahala Point,HI","Grounds open, tower closed"
