-91.6637,47.0138,"Two Harbors Lighthouse-Two Harbors,MN","Grounds open, lighthouse open to tours daily in season and to overnight guests year round.Tours of Two Harbors Lighthouse, which operates year round as the Lighthouse Bed and Breakfast, are offered Monday - Saturday, 9 a.m. - 5 p.m. and Sundays from 10 a.m. - 4 p.m., May through October. Call (218) 834-4898  "
-88.90121,30.39445,"Biloxi Lighthouse-Biloxi,MS","The lighthouse was closed to the public after Hurrican Katrina. It has reopened and tours are offered at 9,9:15 and 9:30 mon thru sat. (228) 374-3105"
-88.55594,30.370654,"Round Island Lighthouse-Round Island,MS","Grounds open, Tower closed. The lighthouse has been restored and is located in Pascagoula,MS near the intersection of Hwy 90 and Pascagoula St."
-88.9667,30.2116,"Ship Island Lighthouse-Ship Island,MS",Ferry service to ship island and a 0.3 mile hike where the lighthouse once stood. Grounds open/Tower closed. A replica of Ship Island Lighthouse is located at Gulfport Marina.
-78.0004,33.8736,"Bald Head Lighthouse-Bald Head Island,NC","Requires 20 minute ferry ride from Southport. For a fee, visitors are allowed to climb the tower.Grounds/Tower/dwelling open. (910) 457-7481|108 steps"
-75.5633,35.8185,"Bodie Island Lighthouse-Cape Hatteras National Seashore,NC","Keeper's dwelling is open daily from 9 am to 6 pm Mem day to Labor day, from 9 am to 5 pm remainder of year.Grounds/dwelling open, Tower open mid April until mid Oct.Tickets must be purchased on line. (252) 441-5711|214 steps"
-77.9677,33.8459,"Cape Fear Lighthouse-Smith Island,NC","Site Only-See info on Bald Head Island Lighthouse. Grounds open, dwellings available for rent"
-75.528821,35.250513,"Cape Hatteras Lighthouse-Buxton,NC","Currently Closed for Restoration thru 2023|Open daily from 9 am to 6 pm Mem day to Labor day, from 9 am to 5 pm remainder of year.Grounds/dwelling open, Tower open.. (252) 995-4474"
-76.5247,34.6226,"Cape Lookout Lighthouse-Harkers Island,NC","Ferry ride required to reach island.Dwelling is open from 9 am to 5 pm, Apr to Nov. As of 6/24/08, Tower tours have been suspended pending repairs. Thru 2024"
-75.830726,36.376649,"Currituck Beach Lighthouse-Corolla,NC",Open daily from mid-march thru dec. Grounds/Tower/dwelling open. (252) 453-4939|220 steps
-78.0351,33.8929,"Oak Island Lighthouse-Oak Island Coast Guard Station,NC",The tower is open for climbs to the second floor level on Wed and Sat between 10 a.m. and 2 p.m. from Mem Day to Labor Day. Climb to the top of the lighthouse by appointment only. (contact:lighthouse-tours@caswellbeach.org)
-75.986,35.109,"Ocracoke Lighthouse-Ocracoke Village,NC","Ferry ride required to reach Ocracoke Island. Grounds open, Tower/dwelling closed."
-77.9896,33.936,"Price's Creek Light-Price creek enters Cape Fear River,NC","Must be seen by boat. Private property, Grounds/Tower closed"
-75.66819,35.90813,"Roanoke Marshes (Replica) Lighthouse-Manteo,NC","Grounds open, lighthouse open in season. (252) 475-1750"
-76.61098,36.05678,"Roanoke River Lighthouse-Edenton,NC","Grounds open,Tower/dwelling closed. Presently undergoing restoration"
-76.75353,35.86606,"Roanoke River (Replica)Lighthouse-Plymouth,NC","Open in the summer from 11 am to 3 pm, Tues thru Sat. or by appointment. (252) 217-2204. Grounds open year-round."
-72.0686,43.37222,"Burkehaven Light-Lake Sunapee,NH",Best viewed by boat. Tower closed
-72.0421,43.411,"Herrick Cove Light-Lake Sunapee,NH",Best viewed by boat. Tower closed
-70.6237,42.9676,"Isles of Shoals (White Island) Light-White Island,NH","Locate on White Island, 7 miles offshore from Portsmouth harbor. Grounds open. Tower/dwellings closed"
-72.0598,43.3919,"Loon Island Light-Lake Sunapee,NH",Best viewed by boat. Tower closed
-70.7083,43.0708,"Portsmouth Harbor Lighthouse-New Castle Island,NH",Located on the grounds of Fort Constitution. Grounds/Tower open during open houses. Contact  FPHL@lighthouse.cc for dates of tours. Tower open for tours
-74.41413,39.36647,"Absecon Lighthouse-Atlantic City,NJ","Open from 10:00 a.m. to 5:00 p.m. daily, July - Aug, and 11:00 a.m. - 4:00 p.m. Thurs thru Mon the remainder of the year. You can climb the tower. Call (609) 449-1360. "
-74.106,39.7643,"Barnegat Lighthouse-Barnegat Island State Park,NJ","Open for climbing daily the entire year, weather permitting. From Apr 1 thru Oct 31, the lighthouse is open daily from 9:00 a.m. to 4:30 p.m. Open from 9:00 a.m. to 3:30 p.m., Wed-- Sun-, the remainder of the year. Call (609) 494-2016  "
-75.1124,39.9573,"Barnegat Lightship-Camden,NJ","Privately owned. Grounds open, lightship closed"
-75.11353,38.98636,"Brandywine Shoal Lighthouse-offshore in Delaware Bay,NJ",Best seen from the water. Tower closed
-74.95997,38.933332,"Cape May Lighthouse-Cape May State Park,NJ","Open daily, Apr thru Nov, and on weekends most of the rest of the year. Call (609) 884-5404 for exact hours. Grounds/Tower open, dwelling closed"
-74.0588,40.3983,"Chapel Hill Rear Range Lighthouse-1.5miles south of Conover Beacon,NJ",Privately owned. Grounds/Tower/dwelling closed. View from Navesink lighthouse
-74.05562,40.421395,"Conover Beacon Light-Leonardo,NJ","Grounds open, Tower closed"
-75.23074,39.20396,"Cross Ledge Light-Delaware Bay-4 miles offshore from Fortescue,NJ",Remains best seen from the water
-75.02709,39.1957,"East Point Lighthouse-Heislerville,NJ",Grounds open. Tower/dwelling open during tours. Tours are from 1 pm to 4 pm on the 3rd Sun of the month. Apr thru Oct.
-75.26828,39.18162,"Elbow of Cross Ledge Light-Delaware Bay-5 miles offshore from Fortescue,NJ",Best seen from the water. Tower closed
-75.53389,39.617175,"Finns Point Range Light-Pennsville,NJ","Grounds open, Tower closed. Call (856) 935-1487 for more information"
-74.2532,40.4867,"Great Beds Light-offshore of South Amboy,NJ",Best seen from the water. Tower closed
-74.79166,39.0067,"Hereford Inlet Lighthouse-North Wildwood,NJ","Open daily from 9 am to 5 pm mid-May thru mid-Oct and 10 am to 4 pm, Wed thru Sun for the rest of the year. Grounds open. Tower/dwelling open in season. (609) 522-4520"
-74.0403,40.7097,"Liberty(Winter Quarter) Lightship-Liberty State Park,NJ","Called the Lightship Bar and Grill. Open 7 days a week from 11 am to 11 pm. Grounds open, lightship open during restaurant hrs. (201) 985- 8174"
-74.688,39.1597,"Ludlum Beach Light-Sea Isle City,NJ","Privately owned. Grounds open, dwelling closed"
-75.20966,39.12643,"Miah Maull Shoal Lighthouse-center of Delaware Bay,NJ",Best seen from the water. Tower closed
-73.98562,40.39587,"Navesink(Twin lights) Lighthouse-Highlands,NJ","Museum, tower and gift shop are open daily from 10 a.m. to 4:30 p.m., Mem Day to Labor Day. The rest of the year, the lighthouse is open Wed to Sunday 10 a.m. to 4:30 p.m.  Grounds are always open from 9 a.m. until sunset.  (732) 872-1814"
-74.065,40.6574,"Robbins Reef Lighthouse-New York Harbor off Staten Island,NJ",Best seen from the water. Tower closed
-74.0135,40.5126,"Romer Shoal Lighthouse-offshore of Sandy Hook,NJ",Best seen from the water. Tower closed
-74.00167,40.4617,"Sandy Hook Lighthouse-Sandy Hook,NJ","Open weekends year-round with tours offered. From Apr thru Oct, tours are also offered on weekdays. Grounds open, Tower/dwelling open during tours. (732) 872-5970"
-74.02746,40.13666,"Sea Girt Lighthouse-Sea Girt,NJ","Open Apr thru Nov on Sundays from 2 pm to 4 pm. Grounds open, Tower/dwelling open in season. (732) 974-0514"
-75.37651,39.30496,"Ship John Shoal Light-2.8 miles south of Cohansey River,NJ",Best seen from the water. Tower closed
-75.23956,39.847433,"Tinicum Rear Range Light-Billingsport,NJ","Open in the past on the 3rd weekend of each month from Apr to Oct. Grounds open, Tower open during season. (856) 423-1505 or (856) 423-2545"
-74.3424,39.6018,"Tucker's Beach Lighthouse-Tuckerton,NJ",Call (609) 296-8868 for hours of operation
-74.0029,40.7056,"Ambrose Lightship-Lower Manhatten,NY","Grounds open, lightship open for museum guests"
-73.4052,44.1526,"Barber's Point Lighthouse-Westport,NY",Can be seen from Barbers Lane. Privately owned. Grounds/dwelling/Tower closed
-79.5948,42.3411,"Barcelona (Portland Harbor) Light-Barcelona,NY",Can be seen from Hwy 5. Privately owned. Grounds/dwelling/Tower closed
-73.9408,40.7718,"Blackwell Island Light-Roosevelt Island in the East River,NY","Grounds open, Tower closed"
-73.4304,44.6231,"Bluff Point (Valcour Island) Lighthouse-Valcour Island in Lake Champlain,NY","Grounds open, Tower/dwelling open in season. Tours on Sun from 1 pm to 3 pm between Jul 1 and Labor Day. You still have to make arrangements to get to the island"
-77.762,43.3408,"Braddock Point Lighthouse-west of Rochester,NY","Privately owned. Grounds/Tower/dwelling closed. Decent photos can be obtained from Bogus Point Park, west of the Lighthouse."
-76.14464,43.24117,"Brewerton Range Rear-Brewerton,NY","Grounds open, Tower closed"
-78.90238,42.87067,"Buffalo Harbor Lighthouse-Buffalo,NY","Best viewed from the water, but can be seen from Buffalo Main Lighthouse. Tower closed"
-78.9107,42.8818,"Buffalo Intake Crib Light-offshore from Buffalo,NY","Best viewed from the water, but can be seen in the distance from Buffalo Main Lighthouse. Tower closed"
-78.89,42.8774,"Buffalo Main Lighthouse-Buffalo,NY",Public access only permitted with escort. Grounds open with Coast Guard escort. Tower closed
-78.8906,42.8773,"Buffalo North Breakwater Light-Buffalo,NY",Public access only permitted with escort. Grounds open with Coast Guard escort. Tower closed
-79.35341,42.49317,"Buffalo South Entrance North Side-Buffalo,NY",Relocated to the Dunkirt Lighthouse and Veterans Park Museum. See info on Dunkirk Lighthouse
-78.86744,42.83369,"Buffalo South Entrance South Side-Buffalo,NY","Inaccessible due to the surrounding insustrial properties. View from water. Grounds open, Tower closed"
-76.3317,44.1191,"Cape Vincent Breakwater Light-Cape Vincent,NY","Grounds open, Tower closed"
-76.515652,42.464311,"Cayuga Inlet Lighthouse( near Ithaca)-Cayuga Inlet,NY",Accessible at end of breakwater
-76.514303,42.462568,"Cayuga Inlet Breakwater Light(near Ithaca)-Cayuga Inlet,NY",Visible offshore from Cayuga Inlet Light
-72.261,41.0408,"Cedar Island Lighthouse-4 miles northeast of Sag Harbor,NY",Located in Cedar Point County Park.Grounds open. Tower/dwelling closed
-77.6108,43.253,"Charlotte-Genesse Lighthouse-Rochester,NY","Open from 1 pm to 5 pm on Sat and Sun, Mid-May thru Oct. Grounds open, Tower/dwelling open during season. (585) 621-6179"
-73.4931,40.9143,"Cold Spring Harbor Light-near Cold Spring Harbor,NY",Can be seen from Lloyd Beach. Privately owned. Grounds/Tower closed
-74.01185,40.5765,"Coney Island Light-Seagate in Brooklyn,NY",Located in gated community of Seagate. Grounds/Tower/dwelling closed
-75.7821,44.4974,"Crossover Island Light- Crossover Island-St Lawrence River,NY","Best seen by boat, but can be seen from River Ledge Road (road parallel to Hwy 12). Grounds/Tower/dwelling closed"
-73.4214,44.0299,"Crown Point Light-Crown Point State Historic Site,NY","Located in Crown Point Public Campground. Grounds open, Tower open in season. Campground (518) 597-3603"
-73.3862,44.6908,"Cumberland Head Lighthouse-east of Plattsburg,NY",Best viewed from water. Privately owned. Grounds/Tower/dwelling closed
-79.3537,42.4936,"Dunkirt(Point Gratiot) Lighthouse-Dunkirk,NY","Open Mon-Tues-Sat from May thru Oct. In Jul and Aug, hours are 10 am to 4 pm. In other months, hours are 10 am to 2 pm. Grounds/Tower/dwelling open in season. (716) 366-5050"
-76.5422,43.9912,"East Charity Shoal Light-offshore near Galloo Island,NY",Best seen by boat. Can be seen with binoculars from Tibbets Point. Tower closed
-73.3949,40.9533,"Eaton's Neck Lighthouse-Eaton's Neck,NY","Located on Coast Guard Station, typically closed to the public. Grounds/Tower closed"
-74.0952,40.564,"Elm Tree Light-Staten Island,NY","Grounds open, Tower closed"
-73.9484,41.8851,"Esopus Meadows Lighthouse-in middle of Hudson River near Esopus,NY",Best viewed from water. Can be seen from Esopus Meadows Park or nearby Lighthouse Park. Open during work parties or occasional tours
-73.7373,40.87804,"Execution Rocks Lighthouse-Offshore of Long Island,NY",Best seen by boat. Grounds/Tower/dwelling open by reservation only. Call 215-906-5103
-73.21789,40.63167,"Fire Island Lighthouse-Fire Island National Seashore,NY","1 mile hike to lighthouse. Open much of the year. Latest hours, call (631) 661-4876"
-79.0633,43.2617,"Fort Niagara Lighthouse-Fort Niagara State Park,NY","Located in Fort Niagara State Park. Grounds open, Tower closed"
-74.0539,40.6041,"Fort Wadsworth Light-Fort Wadsworth,NY","The Fort Wadsworth visitor center is open Wed-Sun from 10 am to 5 pm. Grounds open, Tower closed. (718) 354-4500"
-74.01,40.7501,"Frying Pan Lightship-Hudson River in Manhattan,NY","Privately owned. Grounds open, lightship closed"
-76.4449,43.8883,"Galloo Island Light-Galloo Island,NY",Must be viewed by boat. Privately owned. Grounds/Tower/dwelling closed
-78.9474,42.9761,"Grand Island Front Range Light-Grand Island,NY","Located in Buffalo Launch Club. Grounds open, Tower closed"
-76.1427,43.9429,"Horse Island Lighthouse-Horse Island near Sackets Harbor,NY",Best view by boat. Privately owned. Grounds/Tower/dwelling closed
-78.9125,42.8866,"Horseshoe Reef  Light-offshore in Lake Erie and Niagara River,NY",Best viewed by water. Tower closed
-72.44668,41.085,"Horton Point Lighthouse-Horton Point,NY",Grounds open daily between 8 am and dusk. Lighthouse is open only on weekends from 11:30 am to 4 pm between Mem day and Columbus day. Call (631) 765-5500
-73.81,42.2517,"Hudson-Athens Lighthouse-Hudson River between Athens and Hudson,NY",Visible from South Washington St (Hwy 385) south of Athens.Tours are offered during the summer. Tower/dwelling open during tours
-73.4311,40.91078,"Huntington Harbor (Lloyd Harbor) Lighthouse-offshore on Lloyd's Harbor,NY",Visible from the end of Southdown Road. Tower/dwelling open during tours
-73.94641,40.85015,"Jeffrey's Hook Light-under George Washingtion Bridge,NY","The interior of the lighthouse is occasionally open to the public. For tour dates, call (212) 304-2365"
-71.9335,41.3045,"Latimer Reef Light-offshore of Fisher's Island,NY",Best viewed by boat.Tower closed
-72.1067,41.20611,"Little Gull Island Light-offshore of Palm Island,NY",Best viewed by boat. Grounds/Tower closed
-72.3066,41.11,"Long Beach Bar Lighthouse-offshore of Long Beach,NY","Best seen by boat, but can be seen from Orient Beach State Park. Tower/dwelling closed"
-71.85677,41.0717,"Montauk Point Lighthouse-Montauk Point State Park on Long Island,NY",Open daily during the summer and on weekends during most of the rest of the year. Grounds/Tower/dwelling open during visiting hours.For hours click here or call (631) 668-2544
-71.9333,41.07,"Montauk Yacht Club Lighthouse-Montauk Lake,NY",Owned by Montauk Yacht Club. Grounds/Tower open
-74.0713,40.6424,"Nantucket Lightship Oyster Bay on Long Island-Long Island,NY",Currently anchored at Oyster Bay on Long Island where it is being restored
-74.1201,40.58077,"New Dorp Lighthouse-Staten Island,NY",Privately owned. Grounds/Tower/dwelling closed.
-73.8996,40.7993,"North Brother Island Light-East River near Rikers Island,NY","Best views from the East River. However,most of the lighthouse has collapsed"
-72.0195,41.2881,"North Dumpling Lighthouse-North Dumpling Island,NY",Best seen by boat. Privately owned. Grounds/Tower/dwelling closed
-75.5036,44.6978,"Ogdensburg Harbor Lighthouse-Ogdensburg,NY",Private residence. Grounds/Tower/dwelling closed
-78.71512,43.33874,"Olcott (Replica)-Olcott,NY",Open to the public Thursday through Sunday from noon to 6 p.m Grounds/Tower open
-73.1183,40.9767,"Old Field Point Lighthouse-Old Field,NY",Grounds open. Tower/dwelling closed
-74.1,40.5117,"Old Orchard Shoal Light-offshore in Lower New York Bay,NY",Best seen by boat. Tower closed. (Presently up for auction)
-72.2234,41.1634,"Orient Point Light-offshore of Plum Island,NY",Can be seen from Orient Point County Park. Tower closed
-76.5169,43.4736,"Oswego West Pierhead Lighthouse-Oswego,NY",Can be seen from the H Lee White Marine Museum. Breakwater can be hiked to the lighthouse. Tower/dwelling closed
-72.2114,41.1736,"Plum Island Lighthouse-Plum Island,NY",Best seen by boat. Access to island is restricted.Grounds/Tower/dwelling closed
-73.3601,44.7994,"Point Au Roche Light-Lake Champlain,NY",Privately owned. Grounds/Tower/dwellings closed
-74.2133,40.5076,"Princes Bay Lighthouse-Staten Island,NY",Immediate Grounds/Tower/dwelling closed
-72.0466,41.2434,"Race Rock Lighthouse-offshore in Long Island Sound,NY",Best seen by boat. Tower closed
-77.59897,43.26388,"Rochester Harbor-Rochester,NY","Pier open, Tower closed"
-76.0166,44.2802,"Rock Island Lighthouse-offshore in St Lawrence River near Fishers Landing,NY","Best viewed by boat. Grounds open, Tower/dwelling closed"
-73.9633,41.9217,"Rondout Creek Lighthouse-in Hudson River near Kingston,NY","Tours are offered from the city docks at 1:15 p.m. and 3 p.m. on Saturdays, Sundays and holiday Mondays from Memorial Day weekend to Labor Day. The lighthouse is also visible from the waterfront in Kingston"
-73.7294,40.8659,"Sands Point Lighthouse-on Long Island near Port Washington,NY",Best seen by boat. Privately owned. Grounds/Tower/dwelling closed
-73.93,42.0716,"Saugerties Lighthouse-in Hudson River near Esopus Creek,NY","Tours of the lighthouse are available on weekends from Meml Day thruh Labor Day between noon and 3 p.m. Grounds open,Tower/dwelling open during tours and to overnight guests. Call (845) 247-0656 for more information or to reserve a room at the lighthouse. "
-76.2019,43.5742,"Selkirk Lighthouse-Selkirk,NY","Privately owned. Grounds open, dwelling/tower open to overnight guests. Lighthouse has 3 bedrooms and can accommodate up to 10 people for overnight stays. (315) 298-6688"
-72.5041,40.8505,"Shinnecock Lighthouse-Shinnecock Bay,NY",Site only. Lighthouse destroyed in 1948. Grounds open with permission of Coast Guard
-75.8446,44.414,"Sisters Island Lighthouse-Sister Island in St Lawrence River,NY",Best viewed by boat. Privately owned. Grounds/Tower/dwelling closed
-76.9741,43.2772,"Sodus Outer Light-Sodus Bay,NY","Walk to the end of the pier. Pier open,Tower closed. Can also be seen from the Sodus Point Lighthouse"
-76.98608,43.27259,"Sodus Point Lighthouse-Sodus Point,NY","Open Tues thru Sun from 10 a.m. to 5 p.m., and on Mondays that coincide with holidays. Grounds open, Tower/dwelling open during season. (315) 483-4936. "
-73.3226,44.2676,"Split Rock Lighthouse-Lake Champlain,NY",Best viewed from the water. Private residence. Grounds/Tower/dwelling closed
-74.1413,40.5761,"Staten Island Range Light-Staten Island,NY",Grounds/Tower closed
-74.0446,40.6897,"Statue of Liberty Light-Liberty Island in New York Harbor,NY","Grounds open,Tower closed"
-73.7748,40.8247,"Stepping Stones Lighthouse-offshore of Long Island,NY",Best viewed by boat. Tower/dwelling closed
-76.2985,43.8391,"Stony Point Lighthouse-Stony Point,NY",Privately owned. Grounds/Tower/dwelling closed
-73.97,41.2416,"Stony Point (Hudson River) Light-Stony Point State Park,NY","Open Mid-Apr thru Oct, Mon thru Sat from 10:00 a.m. - 5:00 p.m., and Sunday noon - 5:00 p.m. Winter hours are Monday through Friday from 10:00 a.m. - 4:00 p.m. Call (845) 786-2521 before your visit to confirm the hours and to see if the lighthouse can be opened for tours."
-75.911,44.3458,"Sunken Rock Lighthouse-in St Lawrence River,NY",Can be seen from the shore in Alexandria Bay.Closest view is from an area near Bonnie Castle Resort marina
-73.87481,41.08468,"Tarrytown Light-north of Tappan Zee Bridge on Hudson River,NY",Located in Kingsland Point Park. Tower closed. Lighthouse is open to the public on several occasions during the summer months. Call (914) 366-5109 for exact dates
-78.4861,43.3747,"Thirty Mile Point Lighthouse-Golden Hill State Park,NY",Lighthouse is open daily for tours from 10 a.m. to 6 p.m. in the summer. Call the park at (716) 795-3885 to confirm hours or for more information. Lighthouse can be rented for overnight stays  by calling (800) 456-2267
-73.7916,40.805,"Throgs Neck Light-on Campus of SUNY Maritine College,NY","Grounds open, dwelling closed"
-76.37,44.1005,"Tibbets Point Light-near Cape Vincent,NY","Grounds open, Tower closed"
-74.0042,40.7074,"Titanic Memorial Light-Lower Manhattan,NY","Grounds open, Tower closed"
-75.7317,43.1894,"Verona Beach Light-Verona Beach,NY","Grounds open, Tower closed"
-74.0433,40.5384,"West Bank Light-offshore in Lower New York Bay,NY",Best seen by boat. Tower closed. (Presently up for auction)
-80.7966,41.9183,"Ashtabula Harbor Lighthouse-Ashtabula Harbor,OH","Grounds open, dwelling/tower closed. You can hike the breakwater to the lighthouse, but the blocks in the breakwater are VERY uneven making for an arduous and potentially dangerous journey"
-84.474,40.5102,"Behm's (Grimm Memorial)-Grand Lake St Mary's State Park,OH","Privately owned. Grounds open, Tower closed"
-82.69378,41.4882,"Cedar Point Lighthouse-near-Sandusky,OH","Grounds open, Tower/dwelling closed"
-84.5706,40.5441,"Celina Light-Celina,OH","Grounds open, tower closed. The lighthouse's observation platform is open to the public, but the tower is not"
-81.6516,41.54316,"Cleveland East Entrance Light-Cleveland Harbor,OH",Tower closed. Accessible by boat only.
-81.7155,41.5102,"Cleveland Harbor East Pierhead Light-Cleveland Harbor,OH",Best seen by boat. Grounds/Tower closed
-81.7176,41.5089,"Cleveland Harbor West Pierhead Lighthouse-Cleveland Harbor,OH",Best seen by boat. Grounds/Tower/dwelling closed
-80.5584,41.9794,"Conneaut West Breakwater Light-Conneaut,OH","Viewed from shoreline. Grounds open, Tower closed"
-81.2773,41.757,"Fairport Harbor Lighthouse-Fairport,OH","Grounds open, dwelling/tower open in season. open from 1 p.m. to 6 p.m. Wednesdays, Saturdays, Sundays, and holidays, from Memorial Day weekend through the second weekend in September. The museum can be reached at (440) 354-4825. "
-81.2811,41.7679,"Fairport Harbor West Breakwater Lighthouse-Fairport,OH","Grounds open, Tower closed. You can walk the breakwater to the lighthouse."
-82.8683,41.645,"Green Island Light-South Bass Island,OH",Best seen by boat. Grounds/Tower closed
-82.5465,41.399,"Huron Harbor Light-Huron River and Lake Erie,OH","Grounds open, Tower closed. You can walk a trail to the lighthouse"
-82.19,41.4766,"Loraine Lighthouse-Loraine,OH",Grounds/Tower closed. Can be seen from the breakwater
-83.4982,41.677,"Manhattan Range Lights-Toledo,OH",Privately owned. Towers closed
-82.7115,41.5364,"Marblehead Lighthouse-Marblehead Lighthouse State Park,OH","Grounds open, dwelling/tower open in season. Tours of Marblehead Lighthouse are offered on weekday afternoons from 1:00 p.m. to 4:45 p.m. after Memorial Day until the Friday before Labor Day. Call (419) 797-4530 for confirmation "
-84.4815,40.5437,"Northwood Light-Northwood,OH","Located on Private property, so is best viewed from the water. Grounds/dwelling closed"
-82.81251,41.6542,"Perry Memorial Light-South Bass Island,OH",Grounds/Tower open in season. Requires ferry ride to South Bass Island
-82.934985,41.515103,"Port Clinton Portage River Light-Port Clinton,OH",Grounds open. Tower closed. Waterworks Park.
-82.6743,41.4999,"Sandusky Harbor Breakwater Light-Sandusky,OH",Tower closed. Can be seen from the Cedar Point Amusement Park
-82.8417,41.6386,"South Bass Island Lighthouse-South Bass Island,OH",Grounds/dwelling open during tour.daily tours (excluding Tuesdays) will be offered from mid-June through August. For information call Ohio State's Stone Laboratory at (614) 292-8949. 
-83.3286,41.7618,"Toledo Harbor Lighthouse-8 miles offshore-Toledo,OH",Best seen by boat. Tower/dwelling closed
-83.391,41.7525,"Turtle Island Light-Turtle Island in Lake Erie,OH","Best seen by boat. Privately owned, Grounds/Tower closed"
-82.3666,41.4245,"Vermillion Light-Vermillion,OH","Grounds open, Tower closed"
-83.1102,41.7364,"West Sister Island Light-West Sister Island,OH",Best seen by boat. Tower/dwelling closed
-97.578619,35.565185,"East Wharf [Lake Hefner]-Okalhoma City,OK","Lighthoused marks the entrance to a Marina. Site is open, Tower is closed"
-99.436573,35.415754,"Centennial Lighthouse-Elk City,OK","An active lighthouse that stands beside a small pond, not navigable water. Commemorates the 100th anniversary of OK admission to the union. Grounds open, tower closed."
-124.3754,43.3415,"Cape Arago Lighthouse-Chief's Island,OR","Grounds/dwelling/tower closed.You can view the lighthouse from Hwy 101,You can hike through some rugged terrain to get a closer view, however, the bridge to the island is closed to the public as is the lighthouse"
-124.5628,42.8373,"Cape Blanco Lighthouse-Port Orford,OR","Grounds/tower open in season. Friends of Cape Blanco open the lighthouse for tours from 10 a.m. to 3:30 p.m., Tuesday through Sunday starting on April 1st and running through October. The grounds near the lighthouse are only open during tour hours"
-123.9781,45.4864,"Cape Mears Light -Cape Meares State Scenic Viewpoint,OR","Grounds open, tower open in season.Cape Meares Lighthouse is opened daily April through October from 11 a.m. to 4 p.m. "
-124.1119,44.2816,"Cleft of the Rock (Cape Perpetual) Light-Yachats,OR",Privately owned. Grounds/Tower/dwelling closed. Can be seen from Hwy 101
-124.4234,43.1222,"Coquille River (Bandon) Lighthouse-Bandon,OR","Grounds open, lighthouse/tower open in season.open to the public daily from 10 a.m. to 4 p.m. in May and October. From June through September, the hours are 10 a.m. to 4 p.m. Monday and Tuesday; 9 a.m. to 6 p.m. Wednesday through Sunday. "
